{
  "version": 1,
  "taskId": "route-the-wiki-store-through-its-owner",
  "revisionId": "revision-50be2644f2ca2981",
  "surfaceBasis": "first-revision",
  "changedPaths": [
    ".agent/skills/openspec-apply-change/SKILL.md",
    ".agent/skills/openspec-archive-change/SKILL.md",
    ".agent/skills/openspec-bulk-archive-change/SKILL.md",
    ".agent/skills/openspec-continue-change/SKILL.md",
    ".agent/skills/openspec-explore/SKILL.md",
    ".agent/skills/openspec-ff-change/SKILL.md",
    ".agent/skills/openspec-new-change/SKILL.md",
    ".agent/skills/openspec-onboard/SKILL.md",
    ".agent/skills/openspec-propose/SKILL.md",
    ".agent/skills/openspec-sync-specs/SKILL.md",
    ".agent/skills/openspec-verify-change/SKILL.md",
    ".agent/workflows/opsx-apply.md",
    ".agent/workflows/opsx-archive.md",
    ".agent/workflows/opsx-bulk-archive.md",
    ".agent/workflows/opsx-continue.md",
    ".agent/workflows/opsx-explore.md",
    ".agent/workflows/opsx-ff.md",
    ".agent/workflows/opsx-new.md",
    ".agent/workflows/opsx-onboard.md",
    ".agent/workflows/opsx-propose.md",
    ".agent/workflows/opsx-sync.md",
    ".agent/workflows/opsx-verify.md",
    ".agents/skills/brainstorming/SKILL.md",
    ".agents/skills/brainstorming/scripts/frame-template.html",
    ".agents/skills/brainstorming/scripts/helper.js",
    ".agents/skills/brainstorming/scripts/server.cjs",
    ".agents/skills/brainstorming/scripts/start-server.sh",
    ".agents/skills/brainstorming/scripts/stop-server.sh",
    ".agents/skills/brainstorming/spec-document-reviewer-prompt.md",
    ".agents/skills/brainstorming/visual-companion.md",
    ".agents/skills/comet-any/SKILL.md",
    ".agents/skills/comet-any/agents/openai.yaml",
    ".agents/skills/comet-any/reference/authored-zone-example.md",
    ".agents/skills/comet-any/reference/authoring-subagents.md",
    ".agents/skills/comet-any/reference/bundle-authoring.md",
    ".agents/skills/comet-any/reference/eval-provider.md",
    ".agents/skills/comet-any/reference/subagents/pause-points-author.md",
    ".agents/skills/comet-any/reference/subagents/reference-author.md",
    ".agents/skills/comet-any/reference/subagents/script-author.md",
    ".agents/skills/comet-any/reference/subagents/skill-core-author.md",
    ".agents/skills/comet-any/reference/subagents/skill-reviewer.md",
    ".agents/skills/comet-any/reference/subagents/workflow-entry-author.md",
    ".agents/skills/comet-archive/SKILL.md",
    ".agents/skills/comet-archive/agents/openai.yaml",
    ".agents/skills/comet-build/SKILL.md",
    ".agents/skills/comet-build/agents/openai.yaml",
    ".agents/skills/comet-classic/SKILL.md",
    ".agents/skills/comet-classic/agents/openai.yaml",
    ".agents/skills/comet-classic/reference/auto-transition.md",
    ".agents/skills/comet-classic/reference/classic-layout.md",
    ".agents/skills/comet-classic/reference/comet-yaml-fields.md",
    ".agents/skills/comet-classic/reference/context-recovery.md",
    ".agents/skills/comet-classic/reference/debug-gate.md",
    ".agents/skills/comet-classic/reference/decision-point.md",
    ".agents/skills/comet-classic/reference/dirty-worktree.md",
    ".agents/skills/comet-classic/reference/file-structure.md",
    ".agents/skills/comet-classic/reference/intent-frame.md",
    ".agents/skills/comet-classic/reference/scripts.md",
    ".agents/skills/comet-classic/reference/subagent-dispatch.md",
    ".agents/skills/comet-classic/reference/workspace.md",
    ".agents/skills/comet-design/SKILL.md",
    ".agents/skills/comet-design/agents/openai.yaml",
    ".agents/skills/comet-hotfix/SKILL.md",
    ".agents/skills/comet-hotfix/agents/openai.yaml",
    ".agents/skills/comet-memory/SKILL.md",
    ".agents/skills/comet-memory/agents/openai.yaml",
    ".agents/skills/comet-open/SKILL.md",
    ".agents/skills/comet-open/agents/openai.yaml",
    ".agents/skills/comet-review/SKILL.md",
    ".agents/skills/comet-review/agents/openai.yaml",
    ".agents/skills/comet-tweak/SKILL.md",
    ".agents/skills/comet-tweak/agents/openai.yaml",
    ".agents/skills/comet-verify/SKILL.md",
    ".agents/skills/comet-verify/agents/openai.yaml",
    ".agents/skills/comet/SKILL.md",
    ".agents/skills/comet/agents/openai.yaml",
    ".agents/skills/comet/reference/auto-transition.md",
    ".agents/skills/comet/reference/comet-yaml-fields.md",
    ".agents/skills/comet/reference/context-recovery.md",
    ".agents/skills/comet/reference/debug-gate.md",
    ".agents/skills/comet/reference/decision-point.md",
    ".agents/skills/comet/reference/dirty-worktree.md",
    ".agents/skills/comet/reference/file-structure.md",
    ".agents/skills/comet/reference/intent-frame.md",
    ".agents/skills/comet/reference/scripts.md",
    ".agents/skills/comet/reference/subagent-dispatch.md",
    ".agents/skills/comet/runtime/classic/checks.yaml",
    ".agents/skills/comet/runtime/classic/guardrails.yaml",
    ".agents/skills/comet/runtime/classic/skill.yaml",
    ".agents/skills/comet/scripts/comet-archive.mjs",
    ".agents/skills/comet/scripts/comet-check.mjs",
    ".agents/skills/comet/scripts/comet-entry-runtime.mjs",
    ".agents/skills/comet/scripts/comet-env.mjs",
    ".agents/skills/comet/scripts/comet-guard.mjs",
    ".agents/skills/comet/scripts/comet-handoff.mjs",
    ".agents/skills/comet/scripts/comet-hook-guard.mjs",
    ".agents/skills/comet/scripts/comet-hook-router.mjs",
    ".agents/skills/comet/scripts/comet-intent.mjs",
    ".agents/skills/comet/scripts/comet-resume-probe.mjs",
    ".agents/skills/comet/scripts/comet-runtime.mjs",
    ".agents/skills/comet/scripts/comet-state.mjs",
    ".agents/skills/comet/scripts/comet-yaml-validate.mjs",
    ".agents/skills/command-safety/SKILL.md",
    ".agents/skills/dispatching-parallel-agents/SKILL.md",
    ".agents/skills/executing-plans/SKILL.md",
    ".agents/skills/finishing-a-development-branch/SKILL.md",
    ".agents/skills/kata-archive/SKILL.md",
    ".agents/skills/kata-build/SKILL.md",
    ".agents/skills/kata-collect/SKILL.md",
    ".agents/skills/kata-design/SKILL.md",
    ".agents/skills/kata-hotfix/SKILL.md",
    ".agents/skills/kata-judge/SKILL.md",
    ".agents/skills/kata-open/SKILL.md",
    ".agents/skills/kata-review/SKILL.md",
    ".agents/skills/kata-tweak/SKILL.md",
    ".agents/skills/kata-verify/SKILL.md",
    ".agents/skills/kata-wiki-enrich/SKILL.md",
    ".agents/skills/kata/SKILL.md",
    ".agents/skills/receiving-code-review/SKILL.md",
    ".agents/skills/requesting-code-review/SKILL.md",
    ".agents/skills/requesting-code-review/code-reviewer.md",
    ".agents/skills/subagent-driven-development/SKILL.md",
    ".agents/skills/subagent-driven-development/implementer-prompt.md",
    ".agents/skills/subagent-driven-development/re-review-prompt.md",
    ".agents/skills/subagent-driven-development/scripts/review-package",
    ".agents/skills/subagent-driven-development/scripts/sdd-workspace",
    ".agents/skills/subagent-driven-development/scripts/task-brief",
    ".agents/skills/subagent-driven-development/task-reviewer-prompt.md",
    ".agents/skills/systematic-debugging/CREATION-LOG.md",
    ".agents/skills/systematic-debugging/SKILL.md",
    ".agents/skills/systematic-debugging/condition-based-waiting-example.ts",
    ".agents/skills/systematic-debugging/condition-based-waiting.md",
    ".agents/skills/systematic-debugging/defense-in-depth.md",
    ".agents/skills/systematic-debugging/find-polluter.sh",
    ".agents/skills/systematic-debugging/root-cause-tracing.md",
    ".agents/skills/systematic-debugging/test-academic.md",
    ".agents/skills/systematic-debugging/test-pressure-1.md",
    ".agents/skills/systematic-debugging/test-pressure-2.md",
    ".agents/skills/systematic-debugging/test-pressure-3.md",
    ".agents/skills/test-driven-development/SKILL.md",
    ".agents/skills/test-driven-development/writing-good-tests.md",
    ".agents/skills/using-git-worktrees/SKILL.md",
    ".agents/skills/using-superpowers/SKILL.md",
    ".agents/skills/using-superpowers/references/antigravity-tools.md",
    ".agents/skills/using-superpowers/references/codex-tools.md",
    ".agents/skills/using-superpowers/references/pi-tools.md",
    ".agents/skills/verification-before-completion/SKILL.md",
    ".agents/skills/writing-plans/SKILL.md",
    ".agents/skills/writing-plans/plan-document-reviewer-prompt.md",
    ".agents/skills/writing-skills/SKILL.md",
    ".agents/skills/writing-skills/anthropic-best-practices.md",
    ".agents/skills/writing-skills/examples/CLAUDE_MD_TESTING.md",
    ".agents/skills/writing-skills/graphviz-conventions.dot",
    ".agents/skills/writing-skills/persuasion-principles.md",
    ".agents/skills/writing-skills/render-graphs.js",
    ".agents/skills/writing-skills/testing-skills-with-subagents.md",
    ".comet/config.yaml",
    ".gitignore",
    ".kata-config.json",
    ".kata/tasks/adequacy-task/judge.json",
    ".kata/tasks/adversarial-admissibility/adversarial-review.json",
    ".kata/tasks/adversarial-admissibility/change-record-revision-0afcee791adfb565.json",
    ".kata/tasks/adversarial-admissibility/change-record-revision-0ea09d6400926aa5.json",
    ".kata/tasks/adversarial-admissibility/change-record-revision-11d661824a2cd469.json",
    ".kata/tasks/adversarial-admissibility/change-record-revision-1f0495b4756336db.json",
    ".kata/tasks/adversarial-admissibility/change-record-revision-281b83290ee86e83.json",
    ".kata/tasks/adversarial-admissibility/change-record-revision-4eae642da67cbbee.json",
    ".kata/tasks/adversarial-admissibility/change-record-revision-58bbda9ebb300b96.json",
    ".kata/tasks/adversarial-admissibility/change-record-revision-5db843a10894a7aa.json",
    ".kata/tasks/adversarial-admissibility/change-record-revision-608fd1648776ca69.json",
    ".kata/tasks/adversarial-admissibility/change-record-revision-688020fb2f6e93ca.json",
    ".kata/tasks/adversarial-admissibility/change-record-revision-7dcfe17bf7ad4d79.json",